{
  "name": "Miss_Peeled",
  "version": "2.14",
  "class": "Assassin",
  "level": 150,
  "signetsEaten": 400,
  "allSkillsBonus": 32,
  "classSkillsBonus": 10,
  "stats": {
    "baseStrength": 50,
    "baseDexterity": 725,
    "baseVitality": 0,
    "baseEnergy": 0,
    "strength": 70,
    "dexterity": 1160,
    "vitality": 15,
    "energy": 15,
    "life": 12338,
    "mana": 4457,
    "percent_strength": 60,
    "percent_dexterity": 116,
    "percent_vitality": 62,
    "percent_energy": 62,
    "maximum_life": 30,
    "maximum_mana": 58,
    "all_skills": 32,
    "class_skill_levels": 10,
    "maximum_skill_level": 0,
    "experience_gained": 84,
    "life_stolen_per_hit": 14,
    "life_after_each_kill": 50,
    "life_on_striking": 2,
    "life_on_melee_attack": 142,
    "life_regenerated_per_second": 71.2,
    "regenerate_mana": 10,
    "cold_resistance": 207,
    "maximum_cold_resistance": 12,
    "fire_resistance": 160,
    "maximum_fire_resistance": 11,
    "lightning_resistance": 56,
    "maximum_lightning_resistance": 10,
    "poison_resistance": 178,
    "maximum_poison_resist": 10,
    "magic_resistance": 4,
    "physical_resistance": 7,
    "physical_damage_taken_reduced": 75,
    "poison_length_reduction": 85,
    "curse_length_reduction": 30,
    "cold_absorb": 6,
    "fire_absorb": 5,
    "lightning_absorb": 7,
    "magic_find": 146,
    "gold_find": -10,
    "movement_speed": 59,
    "light_radius": 7,
    "attack_speed": 45,
    "cast_speed": 45,
    "hit_recovery": 125,
    "block_speed": 50,
    "total_character_defense": 209,
    "enhanced_weapon_damage": 97,
    "attack_rating": 545,
    "percent_attack_rating": 471,
    "chance_of_crushing_blow": 11,
    "deadly_strike": 4,
    "avoid_chance": 5,
    "slows_target_by": 20,
    "minimum_cold_damage": 175,
    "maximum_cold_damage": 325,
    "minimum_fire_damage": 375,
    "maximum_fire_damage": 625,
    "minimum_lightning_damage": 375,
    "maximum_lightning_damage": 625,
    "cold_spell_damage": 95,
    "enemy_cold_resistance": 65,
    "fire_spell_damage": 94,
    "enemy_fire_resistance": 43,
    "lightning_spell_damage": 96,
    "enemy_lightning_resistance": 105,
    "poison_spell_damage": 94,
    "enemy_poison_resistance": 19,
    "physical_magic_spell_damage": 98,
    "summoned_minion_life": 114,
    "summoned_minion_damage": 41,
    "summoned_minion_resistances": 26,
    "summoned_minion_attack_rating": 10
  },
  "skillPoints": {
    "Blink": 1,
    "Shadow Refuge": 2,
    "Shadowrush": 6,
    "Perfect Being": 20,
    "Queen of Blades": 2,
    "Storm Crows": 1,
    "APF-20 'Maelstrom' MkV": 1,
    "Black Wind": 1,
    "Void Gazer": 10,
    "Noctule": 25,
    "Way of the Gryphon": 25,
    "Batstrike": 1,
    "Anathema": 1,
    "Vampiric Strike": 5,
    "Way of the Phoenix": 25,
    "Purity": 4,
    "Melee Devotion": 1,
    "Continuity": 1,
    "Prismatic Cloak": 15,
    "Way of the Raven": 15,
    "Paragon of Sanctity": 1
  },
  "oSkills": {
    "Disintegrate": 12,
    "Hailstorm": 20,
    "Jitan's Gate": 1,
    "Lightning Shield": 20,
    "Lightning Wall": 19,
    "Purify": 4,
    "Stormclash": 20,
    "Summon Edyrem": 1,
    "Teleport": 15,
    "Vindicate": 1,
    "Voidstar": 28,
    "Whirlwind": 14
  },
  "questsCompleted": {
    "den_of_evil": {
      "normal": true,
      "nightmare": true,
      "hell": true
    },
    "radament": {
      "normal": true,
      "nightmare": true,
      "hell": true
    },
    "izual": {
      "normal": true,
      "nightmare": true,
      "hell": true
    },
    "lam_essen's_tome": {
      "normal": true,
      "nightmare": true,
      "hell": true
    },
    "golden_bird": {
      "normal": true,
      "nightmare": true,
      "hell": true
    },
    "inquisitor_of_the_triune": {
      "normal": false,
      "nightmare": false,
      "hell": true
    },
    "justicar_signet": {
      "normal": false,
      "nightmare": false,
      "hell": true
    }
  }
}
